{
  "schema_version": "ssr.question-analysis.v1",
  "analysis_id": "analysis-2026-0002",
  "run_id": "run-2026-0002",
  "message_id": "msg-2026-0002",
  "context_snapshot_id": "ctx-2026-0042",
  "questions": [
    { "question_id": "q-1", "query_type": "game_item", "question_text": "灰燼狐的進化道具在哪裡取得？" },
    { "question_id": "q-2", "query_type": "weather", "question_text": "東京現在會下雨嗎？" }
  ]
}
